{
 "blueprint_id": "AR_TAX_BP_0003",
 "reserved_item_id": "AR_TAX_0003",
 "provenance_class": "taxonomy_only",
 "governing_ruling": "docs/patches/TAXONOMY_SUPPLEMENT_RULINGS_V1.md",
 "packet": "docs/specs/SUPPLEMENTAL_BLUEPRINT_PACKET_V1.md",
 "cell": {
  "question_type": "PA",
  "target_difficulty": 3
 },
 "recipe": {
  "recipe_id": "PARALLEL_REASONING_FORM",
  "recipe_title": "Match the Argument",
  "seed_row": "db/seeds/0002_recipes_seed.sql#PARALLEL_REASONING_FORM"
 },
 "credited_answer_job": "Select the choice whose argument reproduces the stimulus argument's abstract logical form.",
 "argument_form": "Valid two-step conditional chain concluded by contrapositive (if A then B; if B then C; not C; therefore not A) in concrete everyday content; all five choices at uniform topic distance.",
 "trap_plan": [
  {
   "slot": 1,
   "trap_family": "Form Failure",
   "mechanism": "Same topic flavor and vocabulary rhythm, different underlying form (single conditional plus unrelated observation).",
   "blind_solve_survivor": true,
   "seed_row": "db/seeds/0001_trap_taxonomy_seed.sql#Form Failure"
  },
  {
   "slot": 2,
   "trap_family": "Parallel Failure",
   "mechanism": "Matches the conclusion type (a negative claim) but premise structure differs (disjunctive elimination, not a chain).",
   "blind_solve_survivor": true,
   "seed_row": "db/seeds/0001_trap_taxonomy_seed.sql#Parallel Failure"
  },
  {
   "slot": 3,
   "trap_family": "Inference Failure",
   "mechanism": "Choice argument is invalid (affirms the consequent) where the stimulus is valid.",
   "blind_solve_survivor": false,
   "seed_row": "db/seeds/0001_trap_taxonomy_seed.sql#Inference Failure"
  },
  {
   "slot": 4,
   "trap_family": "Scope Failure",
   "mechanism": "Quantifier strength mismatch: replaces the universal chain with a most-chain (permitted weaker slot).",
   "blind_solve_survivor": false,
   "seed_row": "db/seeds/0001_trap_taxonomy_seed.sql#Scope Failure"
  }
 ],
 "trap_plan_constraints": {
  "same_family_attractive_min": 3,
  "eliminable_max": 1,
  "blind_solve_survivors_min": 2
 },
 "structural_spec": {
  "moving_parts_min": 3,
  "stimulus_length_band": "short",
  "word_floor": 45,
  "reasoning_density": "moderate",
  "standard": "docs/patches/CONTENT_DIFFICULTY_CALIBRATION_V1.md",
  "first_principles_d3_frame": "d4 parallels in the clean anchor set layer three or more logical steps or mix operator types with subtle validity contrasts among several choices; d3 is one clean chain plus contrapositive, a single operator type, and exactly two near-form competitors."
 },
 "taxonomy_basis": {
  "recipe_rows": [
   "PARALLEL_REASONING_FORM"
  ],
  "trap_rows": [
   "Form Failure",
   "Parallel Failure",
   "Inference Failure",
   "Scope Failure"
  ]
 },
 "authoring": {
  "method": "source_isolated_ai_assisted_draft_human_accepted",
  "ai_assistance": true,
  "ai_assistance_disclosure": "AI drafting permitted under rulings section 4-5; disclosed per item at acceptance",
  "responsible_human": "operator (named at acceptance)",
  "no_source_consulted_confirmation_required": true,
  "excluded_sources": [
   "original_bank",
   "june2007",
   "pt86",
   "any other LSAT item surface"
  ]
 },
 "difficulty_evidence_plan": {
  "difficulty_status": "prepublication_expert_calibrated_one_sided",
  "method": "one_sided_upper_bracket_R4",
  "blind_solve_min": 5,
  "adjudicator": "named qualified human (Spec 07 section 10.2)",
  "empirical_confirmation_required": true,
  "same_cell_clean_anchors": [],
  "anchor_gap_flag": true,
  "bracket_ratified": true,
  "ratified_by": "docs/patches/DIFFICULTY_EVIDENCE_RULINGS_V1.md#R4",
  "upper_anchors_d4": [
   "AR_V1_B1_0017",
   "AR_V1_B2_0017",
   "AR_V1_B2_0018",
   "AR_V1_B6_0019",
   "AR_V1_B10_0017"
  ],
  "cross_type_d3_anchors": [
   "AR_V1_B3_0003",
   "AR_V1_B1_0003",
   "AR_V1_B4_0010",
   "AR_V1_B4_0007"
  ],
  "excluded_anchors": [
   "AR_V1_B5_0019 (held, B4)",
   "AR_V1_B4_0018 (pt86, unverifiable)",
   "AR_V1_B7_0019 (pt86, unverifiable)",
   "AR_V1_B7_0018 (june2007, unverifiable)"
  ],
  "first_principles_d3_vs_d4_analysis_required": true
 },
 "prohibited_now": "No item prose before schema validation of this blueprint (R6) and remaining stage gates."
}