{
 "blueprint_id": "AR_TAX_BP_0005",
 "reserved_item_id": "AR_TAX_0005",
 "provenance_class": "taxonomy_only",
 "governing_ruling": "docs/patches/TAXONOMY_SUPPLEMENT_RULINGS_V1.md",
 "packet": "docs/specs/SUPPLEMENTAL_BLUEPRINT_PACKET_V1.md",
 "cell": {
  "question_type": "FL",
  "target_difficulty": 2
 },
 "recipe": {
  "recipe_id": "FLAW_DESCRIBE",
  "recipe_title": "Describe the Flaw",
  "seed_row": "db/seeds/0002_recipes_seed.sql#FLAW_DESCRIBE"
 },
 "credited_answer_job": "Name, in abstract terms, the reasoning error the argument actually commits.",
 "argument_form": "Single clean canonical flaw; two premises + conclusion; no layered chain (d2).",
 "trap_plan": [
  {
   "slot": 1,
   "trap_family": "Misdescription",
   "mechanism": "Names a flaw the argument does not commit.",
   "blind_solve_survivor": true,
   "seed_row": "db/seeds/0001_trap_taxonomy_seed.sql#Misdescription"
  },
  {
   "slot": 2,
   "trap_family": "Structure Failure",
   "mechanism": "Mislabels a premise as the conclusion or vice versa.",
   "blind_solve_survivor": false,
   "seed_row": "db/seeds/0001_trap_taxonomy_seed.sql#Structure Failure"
  },
  {
   "slot": 3,
   "trap_family": "Scope Failure",
   "mechanism": "Accuses an overgeneralization the argument does not make.",
   "blind_solve_survivor": false,
   "seed_row": "db/seeds/0001_trap_taxonomy_seed.sql#Scope Failure"
  },
  {
   "slot": 4,
   "trap_family": "Relevance Failure",
   "mechanism": "Criticism that is true but not a reasoning error (permitted weaker slot).",
   "blind_solve_survivor": false,
   "seed_row": "db/seeds/0001_trap_taxonomy_seed.sql#Relevance Failure"
  }
 ],
 "trap_plan_constraints": {
  "same_family_attractive_min": 3,
  "eliminable_max": 1,
  "blind_solve_survivors_min": 0
 },
 "structural_spec": {
  "moving_parts_min": 3,
  "stimulus_length_band": "short",
  "word_floor": 45,
  "reasoning_density": "moderate",
  "standard": "docs/patches/CONTENT_DIFFICULTY_CALIBRATION_V1.md"
 },
 "taxonomy_basis": {
  "recipe_rows": [
   "FLAW_DESCRIBE"
  ],
  "trap_rows": [
   "Misdescription",
   "Structure Failure",
   "Scope Failure",
   "Relevance Failure"
  ]
 },
 "authoring": {
  "method": "source_isolated_ai_assisted_draft_human_accepted",
  "ai_assistance": true,
  "ai_assistance_disclosure": "AI drafting permitted under rulings section 4-5; disclosed per item at acceptance",
  "responsible_human": "operator (named at acceptance)",
  "no_source_consulted_confirmation_required": true,
  "excluded_sources": [
   "original_bank",
   "june2007",
   "pt86",
   "any other LSAT item surface"
  ]
 },
 "difficulty_evidence_plan": {
  "difficulty_status": "prepublication_expert_calibrated",
  "blind_solve_min": 3,
  "adjudicator": "named qualified human (Spec 07 section 10.2)",
  "empirical_confirmation_required": true,
  "same_cell_clean_anchors": [
   "AR_V1_B3_0002",
   "AR_V1_B4_0004"
  ],
  "anchor_gap_flag": false
 },
 "prohibited_now": "No item prose at this stage (rulings section 10)."
}