{
 "blueprint_id": "AR_TAX_BP_0009",
 "reserved_item_id": "AR_TAX_0009",
 "provenance_class": "taxonomy_only",
 "governing_ruling": "docs/patches/TAXONOMY_SUPPLEMENT_RULINGS_V1.md",
 "packet": "docs/specs/SUPPLEMENTAL_BLUEPRINT_PACKET_V1.md",
 "cell": {
  "question_type": "MSS",
  "target_difficulty": 4
 },
 "recipe": {
  "recipe_id": "MSS_SUPPORTED",
  "recipe_title": "Draw the Best-Supported Claim",
  "seed_row": "db/seeds/0002_recipes_seed.sql#MSS_SUPPORTED"
 },
 "credited_answer_job": "Draw the inference the premises most strongly support - credited form C of the verified formal core.",
 "argument_form": "Three quantified premises instantiating P1-P3 over four natural-language categories + one embedded domain qualifier; formal core is the skeleton.",
 "trap_plan": [
  {
   "slot": 1,
   "trap_family": "Direction Failure",
   "mechanism": "D1: contra-supported reversal (\"Most F are not H\") - the premises entail the opposite.",
   "blind_solve_survivor": true,
   "seed_row": "db/seeds/0001_trap_taxonomy_seed.sql#Direction Failure"
  },
  {
   "slot": 2,
   "trap_family": "Scope Failure",
   "mechanism": "D2: \"No F are J\" - stronger than the premises license.",
   "blind_solve_survivor": true,
   "seed_row": "db/seeds/0001_trap_taxonomy_seed.sql#Scope Failure"
  },
  {
   "slot": 3,
   "trap_family": "Inference Failure",
   "mechanism": "D3: illicit conversion (\"Most H are F\").",
   "blind_solve_survivor": false,
   "seed_row": "db/seeds/0001_trap_taxonomy_seed.sql#Inference Failure"
  },
  {
   "slot": 4,
   "trap_family": "Conditional Failure",
   "mechanism": "D4: treats \"most\" as \"all\" and contraposes (F subset of H).",
   "blind_solve_survivor": false,
   "seed_row": "db/seeds/0001_trap_taxonomy_seed.sql#Conditional Failure"
  }
 ],
 "trap_plan_constraints": {
  "same_family_attractive_min": 3,
  "eliminable_max": 1,
  "blind_solve_survivors_min": 2
 },
 "structural_spec": {
  "moving_parts_min": 4,
  "stimulus_length_band": "medium",
  "word_floor": 60,
  "reasoning_density": "high",
  "standard": "docs/patches/CONTENT_DIFFICULTY_CALIBRATION_V1.md"
 },
 "taxonomy_basis": {
  "recipe_rows": [
   "MSS_SUPPORTED"
  ],
  "trap_rows": [
   "Direction Failure",
   "Scope Failure",
   "Inference Failure",
   "Conditional Failure"
  ]
 },
 "authoring": {
  "method": "source_isolated_ai_assisted_draft_human_accepted",
  "ai_assistance": true,
  "ai_assistance_disclosure": "AI drafting permitted under rulings section 4-5; disclosed per item at acceptance",
  "responsible_human": "operator (named at acceptance)",
  "no_source_consulted_confirmation_required": true,
  "excluded_sources": [
   "original_bank",
   "june2007",
   "pt86",
   "any other LSAT item surface"
  ]
 },
 "difficulty_evidence_plan": {
  "difficulty_status": "prepublication_expert_calibrated",
  "blind_solve_min": 3,
  "adjudicator": "named qualified human (Spec 07 section 10.2)",
  "empirical_confirmation_required": true,
  "same_cell_clean_anchors": [],
  "anchor_gap_flag": true,
  "proposed_bracket": {
   "same_type_d3": [
    "AR_V1_B3_0009",
    "AR_V1_B3_0010",
    "AR_V1_B4_0016"
   ],
   "cross_type_d4": [
    "AR_V1_B1_0006",
    "AR_V1_B1_0017",
    "AR_V1_B10_0017"
   ]
  },
  "disputed_same_cell_excluded": [
   "AR_V1_B10_0015",
   "AR_V1_B5_0018"
  ],
  "bracket_ratified": true,
  "ratified_by": "docs/patches/DIFFICULTY_EVIDENCE_RULINGS_V1.md#R3",
  "not_one_level_easier_finding_required": true
 },
 "prohibited_now": "No item prose at this stage (rulings section 10).",
 "formal_core": {
  "predicates": [
   "F",
   "G",
   "H",
   "J"
  ],
  "premises": {
   "P1": "Most F are G (|F&G| > |F|/2, F nonempty)",
   "P2": "All G are H (G subset H)",
   "P3": "No H are J (H&J empty)"
  },
  "credited": "C: Most F are not J",
  "distractor_forms": {
   "D1": "Most F are not H",
   "D2": "No F are J",
   "D3": "Most H are F",
   "D4": "All non-H are non-F (F subset H)"
  },
  "verifier": "scripts/content/verify_mss_formal_core.py",
  "verification_status": "PASS (605 premise-satisfying models, |U| 1..4; C entailed; Most-F-are-H entailed; countermodels exhibited for D1-D4)",
  "gate": "A3 re-run required after final predicate/prose instantiation (R2); passing transcript plus a recorded 1:1 prose-to-schema mapping are A6 conditions."
 }
}