{
 "blueprint_id": "AR_TAX_BP_0008",
 "reserved_item_id": "AR_TAX_0008",
 "provenance_class": "taxonomy_only",
 "governing_ruling": "docs/patches/TAXONOMY_SUPPLEMENT_RULINGS_V1.md",
 "packet": "docs/specs/SUPPLEMENTAL_BLUEPRINT_PACKET_V1.md",
 "cell": {
  "question_type": "NA",
  "target_difficulty": 4
 },
 "recipe": {
  "recipe_id": "NA_REQUIRED",
  "recipe_title": "What the Argument Must Assume",
  "seed_row": "db/seeds/0002_recipes_seed.sql#NA_REQUIRED"
 },
 "credited_answer_job": "State the unstated condition without which the support gives the conclusion nothing; must pass the negation test cleanly.",
 "argument_form": "Two-premise support with a suppressed bridge across a subtle term shift + one embedded qualifier; credited assumption is modest in strength (d4 NA architecture).",
 "trap_plan": [
  {
   "slot": 1,
   "trap_family": "Scope Failure",
   "mechanism": "Too-strong sufficient-style version of the bridge.",
   "blind_solve_survivor": true,
   "seed_row": "db/seeds/0001_trap_taxonomy_seed.sql#Scope Failure"
  },
  {
   "slot": 2,
   "trap_family": "Direction Failure",
   "mechanism": "Helps the conclusion but is not required; fails the negation test.",
   "blind_solve_survivor": true,
   "seed_row": "db/seeds/0001_trap_taxonomy_seed.sql#Direction Failure"
  },
  {
   "slot": 3,
   "trap_family": "Conditional Failure",
   "mechanism": "Sufficient/necessary swap of the bridge.",
   "blind_solve_survivor": false,
   "seed_row": "db/seeds/0001_trap_taxonomy_seed.sql#Conditional Failure"
  },
  {
   "slot": 4,
   "trap_family": "Causal Failure",
   "mechanism": "Assumes a causal story the argument does not need (permitted weaker slot).",
   "blind_solve_survivor": false,
   "seed_row": "db/seeds/0001_trap_taxonomy_seed.sql#Causal Failure"
  }
 ],
 "trap_plan_constraints": {
  "same_family_attractive_min": 3,
  "eliminable_max": 1,
  "blind_solve_survivors_min": 2
 },
 "structural_spec": {
  "moving_parts_min": 4,
  "stimulus_length_band": "medium",
  "word_floor": 60,
  "reasoning_density": "high",
  "standard": "docs/patches/CONTENT_DIFFICULTY_CALIBRATION_V1.md"
 },
 "taxonomy_basis": {
  "recipe_rows": [
   "NA_REQUIRED"
  ],
  "trap_rows": [
   "Scope Failure",
   "Direction Failure",
   "Conditional Failure",
   "Causal Failure"
  ]
 },
 "authoring": {
  "method": "source_isolated_ai_assisted_draft_human_accepted",
  "ai_assistance": true,
  "ai_assistance_disclosure": "AI drafting permitted under rulings section 4-5; disclosed per item at acceptance",
  "responsible_human": "operator (named at acceptance)",
  "no_source_consulted_confirmation_required": true,
  "excluded_sources": [
   "original_bank",
   "june2007",
   "pt86",
   "any other LSAT item surface"
  ]
 },
 "difficulty_evidence_plan": {
  "difficulty_status": "prepublication_expert_calibrated",
  "blind_solve_min": 3,
  "adjudicator": "named qualified human (Spec 07 section 10.2)",
  "empirical_confirmation_required": true,
  "same_cell_clean_anchors": [
   "AR_V1_B1_0006"
  ],
  "anchor_gap_flag": false,
  "d3_supplement_anchors_named_pre_draft": true,
  "anchor_disclosure": "AR_V1_B1_0006 shares source ORIG_002 with held AR_V1_B6_0012; that hold is calibration-floor, not originality (Spec 07 section 12.4 inapplicable); B1_0006 label 4 == keyed source 4.",
  "lower_bracket_contrast_d3": [
   "AR_V1_B4_0010",
   "AR_V1_B7_0012",
   "AR_V1_B8_0011"
  ]
 },
 "prohibited_now": "No item prose at this stage (rulings section 10)."
}